{
  "version": "x-api-pilot-1",
  "source_ids": [
    "x_sentdefender",
    "x_osinttechnical"
  ],
  "posts_per_account": 10,
  "max_requests_per_run": 4,
  "run_limit_mill_usd": 120,
  "daily_limit_mill_usd": 120,
  "total_limit_mill_usd": 4500,
  "post_mill_usd": 5,
  "user_mill_usd": 10,
  "minimum_interval_seconds": 3600,
  "initial_lookback_hours": 24,
  "timeout_seconds": 20,
  "max_response_bytes": 500000
}
